{
  "$schema": "https://json-schema.org/draft/2020-12/schema",
  "$id": "https://readyport-app.web.app/schema/index-1.json",
  "title": "ReadyPort pack index (schema_version 1)",
  "description": "지원 국가 목록과 모든 나라에 공통인 연락처(영사콜센터 등).",
  "type": "object",
  "required": [
    "schema_version",
    "version",
    "countries",
    "common_emergency",
    "sources"
  ],
  "additionalProperties": false,
  "properties": {
    "schema_version": {
      "const": 1
    },
    "version": {
      "type": "string",
      "pattern": "^\\d{4}\\.\\d{2}\\.\\d{2}-\\d+$"
    },
    "countries": {
      "type": "array",
      "items": {
        "type": "object",
        "required": [
          "code",
          "name_ko",
          "name_en",
          "pack"
        ],
        "additionalProperties": false,
        "properties": {
          "code": {
            "type": "string",
            "pattern": "^[A-Z]{2}$"
          },
          "name_ko": {
            "type": "string"
          },
          "name_en": {
            "type": "string"
          },
          "pack": {
            "type": "boolean",
            "description": "국가 팩이 있는지. false면 '안내 준비 중'"
          }
        }
      }
    },
    "common_emergency": {
      "type": "array",
      "items": {
        "type": "object",
        "required": [
          "id",
          "label_ko",
          "number",
          "source",
          "last_verified"
        ],
        "additionalProperties": false,
        "properties": {
          "id": {
            "type": "string"
          },
          "label_ko": {
            "type": "string"
          },
          "number": {
            "type": "string",
            "pattern": "^\\+?[0-9 ()-]+$"
          },
          "note_ko": {
            "type": "string"
          },
          "source": {
            "type": "string"
          },
          "last_verified": {
            "type": "string",
            "pattern": "^\\d{4}-\\d{2}-\\d{2}$"
          }
        }
      }
    },
    "sources": {
      "type": "array",
      "items": {
        "type": "object",
        "required": [
          "id",
          "name",
          "url"
        ],
        "additionalProperties": false,
        "properties": {
          "id": {
            "type": "string"
          },
          "name": {
            "type": "string"
          },
          "url": {
            "type": "string",
            "pattern": "^https://"
          }
        }
      }
    },
    "home_power": {
      "type": "object",
      "required": [
        "plug_ko",
        "voltage",
        "frequency",
        "source",
        "last_verified"
      ],
      "additionalProperties": false,
      "properties": {
        "plug_ko": {
          "type": "string"
        },
        "kr_plug_fits": {
          "type": [
            "boolean",
            "null"
          ]
        },
        "voltage": {
          "type": "string"
        },
        "frequency": {
          "type": "string"
        },
        "source": {
          "type": "string"
        },
        "last_verified": {
          "type": "string",
          "pattern": "^\\d{4}-\\d{2}-\\d{2}$"
        }
      }
    },
    "essentials": {
      "description": "꼭 챙길 물건 규칙 (PRD 5.10·11.2). 목록 순서가 추천 순서 — 수수료로 바꾸지 않는다",
      "type": "array",
      "items": {
        "type": "object",
        "required": [
          "id",
          "name_ko",
          "reason_ko",
          "condition"
        ],
        "additionalProperties": false,
        "properties": {
          "id": {
            "type": "string"
          },
          "name_ko": {
            "type": "string"
          },
          "reason_ko": {
            "type": "string"
          },
          "condition": {
            "enum": [
              "always",
              "plug_differs",
              "voltage_differs"
            ]
          },
          "rule_badge": {
            "enum": [
              "carry_on_only"
            ]
          },
          "link": {
            "type": "object",
            "required": [
              "type",
              "url",
              "label_ko"
            ],
            "additionalProperties": false,
            "properties": {
              "type": {
                "enum": [
                  "affiliate",
                  "official_info"
                ]
              },
              "url": {
                "type": "string",
                "pattern": "^https://"
              },
              "label_ko": {
                "type": "string"
              },
              "partner": {
                "type": "string"
              }
            }
          },
          "source": {
            "type": "string"
          },
          "last_verified": {
            "type": "string",
            "pattern": "^\\d{4}-\\d{2}-\\d{2}$"
          }
        }
      }
    },
    "return_links": {
      "type": "array",
      "items": {
        "type": "object",
        "required": [
          "id",
          "label_ko",
          "url"
        ],
        "additionalProperties": false,
        "properties": {
          "id": {
            "type": "string"
          },
          "label_ko": {
            "type": "string"
          },
          "url": {
            "type": "string",
            "pattern": "^https://"
          }
        }
      }
    },
    "return_facts": {
      "type": "array",
      "items": {
        "type": "object",
        "required": [
          "text_ko",
          "source",
          "last_verified"
        ],
        "additionalProperties": false,
        "properties": {
          "text_ko": {
            "type": "string"
          },
          "source": {
            "type": "string"
          },
          "last_verified": {
            "type": "string",
            "pattern": "^\\d{4}-\\d{2}-\\d{2}$"
          }
        }
      }
    },
    "checklist": {
      "description": "여행 체크리스트 틀(모든 나라 공통 순서·안내 문구). 정책 사실은 적지 않는다 — 사실이 필요한 항목은 from 으로 팩·색인 값을 가리키고, 값이 없는 나라에서는 앱이 항목을 만들지 않는다",
      "type": "array",
      "items": {
        "type": "object",
        "required": [
          "id",
          "phase",
          "icon",
          "kind"
        ],
        "additionalProperties": false,
        "properties": {
          "id": {
            "type": "string",
            "pattern": "^[a-z0-9_.]+$"
          },
          "phase": {
            "description": "기한 축(언제까지) — 기한·늦음·알림이 쓴다. 묶는 축은 stage",
            "enum": [
              "month",
              "week",
              "three_days",
              "departure_day",
              "arrival",
              "during",
              "before_return",
              "back"
            ]
          },
          "stage": {
            "description": "묶는 축(할 일의 종류 — 여행 과정 8단계). 화면이 항목을 이 값으로 묶는다. 없으면 앱이 phase 에서 옮겨 온다(예전 서명 팩)",
            "enum": [
              "plan",
              "book",
              "docs",
              "pack",
              "departure",
              "arrival",
              "during",
              "return"
            ]
          },
          "icon": {
            "enum": [
              "passport",
              "visa",
              "flight",
              "insurance",
              "advisory",
              "wallet",
              "data",
              "card",
              "medicine",
              "battery",
              "plug",
              "voltage",
              "offline",
              "map",
              "address",
              "phone",
              "form",
              "phrases",
              "airport",
              "qr",
              "emergency",
              "safe",
              "shopping",
              "customs",
              "cash",
              "flight_return",
              "delete",
              "ticket",
              "hotel",
              "rules",
              "family"
            ]
          },
          "kind": {
            "enum": [
              "generic",
              "auto",
              "pack",
              "essential"
            ]
          },
          "title_ko": {
            "type": "string"
          },
          "body_ko": {
            "type": "string"
          },
          "from": {
            "type": "string",
            "pattern": "^(passport_validity|passport_saved|offline_pack|entry_form|passport_destroyed|visa|advisory|consular|emergency|return_facts|airports|essential:[a-z0-9_]+)$"
          },
          "action": {
            "enum": [
              "open_passport",
              "open_wallet",
              "open_form",
              "open_help",
              "open_present",
              "open_transport",
              "open_shopping",
              "open_essentials",
              "open_return",
              "destroy_passport",
              "open_link",
              "open_airport"
            ]
          },
          "when": {
            "enum": [
              "has_form"
            ]
          }
        }
      }
    }
  }
}
