{
  "schema_version": 1,
  "version": "2026.10.02-1",
  "countries": [
    {
      "code": "TH",
      "name_ko": "태국",
      "name_en": "Thailand",
      "pack": true
    },
    {
      "code": "JP",
      "name_ko": "일본",
      "name_en": "Japan",
      "pack": true
    },
    {
      "code": "SG",
      "name_ko": "싱가포르",
      "name_en": "Singapore",
      "pack": true
    },
    {
      "code": "MY",
      "name_ko": "말레이시아",
      "name_en": "Malaysia",
      "pack": true
    },
    {
      "code": "ID",
      "name_ko": "인도네시아",
      "name_en": "Indonesia",
      "pack": true
    },
    {
      "code": "PH",
      "name_ko": "필리핀",
      "name_en": "Philippines",
      "pack": true
    },
    {
      "code": "VN",
      "name_ko": "베트남",
      "name_en": "Vietnam",
      "pack": true
    }
  ],
  "common_emergency": [
    {
      "id": "consular_call_center",
      "label_ko": "영사콜센터 (서울, 24시간)",
      "number": "+82-2-3210-0404",
      "note_ko": "해외에서 걸 때 번호예요. 통화료가 들어요.",
      "source": "mofa_0404",
      "last_verified": "2026-09-28"
    }
  ],
  "sources": [
    {
      "id": "mofa_0404",
      "name": "외교부 해외안전여행",
      "url": "https://0404.go.kr"
    },
    {
      "id": "visitkorea_power",
      "name": "한국관광공사 VisitKorea (전기)",
      "url": "https://english.visitkorea.or.kr/svc/contents/contentsView.do?vcontsId=140041"
    },
    {
      "id": "molit_powerbank_2026",
      "name": "국토교통부 보조배터리 기내 반입 기준 (2026.4.8 발표)",
      "url": "https://www.korea.kr/news/policyNewsView.do?newsId=148962298"
    },
    {
      "id": "e_insmarket",
      "name": "보험다모아 (손해보험협회·생명보험협회)",
      "url": "https://www.e-insmarket.or.kr/"
    },
    {
      "id": "customs_allowance",
      "name": "관세청 여행자 휴대품 면세 범위",
      "url": "https://customs.go.kr/kcs/cm/cntnts/cntntsView.do?mi=2837&cntntsId=829"
    },
    {
      "id": "apqa_plant",
      "name": "농림축산검역본부 휴대 식물 검역",
      "url": "https://www.apqa.go.kr/plant/imQua/plant_quar_wong_ex.jsp"
    },
    {
      "id": "apqa_livestock",
      "name": "농림축산검역본부 휴대 축산물 검역",
      "url": "https://www.apqa.go.kr/livestock/qua/livestock_imp_sum2.jsp?type=1"
    }
  ],
  "home_power": {
    "plug_ko": "둥근 구멍 2개 콘센트",
    "kr_plug_fits": true,
    "voltage": "220 V",
    "frequency": "60 Hz",
    "source": "visitkorea_power",
    "last_verified": "2026-09-29"
  },
  "essentials": [
    {
      "id": "passport",
      "name_ko": "여권",
      "condition": "always",
      "reason_ko": "출국과 입국에 꼭 필요해요. 남은 유효기간 기준은 나라마다 달라요 — 여행지 안내에서 확인하세요."
    },
    {
      "id": "power_bank",
      "name_ko": "보조배터리",
      "condition": "always",
      "rule_badge": "carry_on_only",
      "reason_ko": "지도·번역을 많이 써서 배터리가 빨리 닳아요. 부치는 짐에 넣을 수 없고, 1인당 2개(160Wh 이하)까지 들고 탈 수 있어요. 기내에서는 충전·사용할 수 없어요. 단자는 절연테이프나 지퍼백으로 감싸세요.",
      "source": "molit_powerbank_2026",
      "last_verified": "2026-09-29"
    },
    {
      "id": "plug_adapter",
      "name_ko": "변환 어댑터",
      "condition": "plug_differs",
      "reason_ko": "한국 플러그가 그대로 맞지 않거나, 맞는지 공식 확인이 안 된 나라예요. 여러 나라용 어댑터를 챙기면 편해요."
    },
    {
      "id": "voltage_check",
      "name_ko": "충전기 전압 확인",
      "condition": "voltage_differs",
      "reason_ko": "여행지 전압이 한국(220V)과 많이 달라요. 충전기·기기에 '100-240V' 표시가 있는지 확인하세요. 없으면 변압기가 필요해요."
    },
    {
      "id": "travel_insurance",
      "name_ko": "여행자 보험",
      "condition": "always",
      "reason_ko": "현지에서 아프거나 다치면 병원비를 직접 내야 할 수 있어요. 보험사 상품을 공식 비교 사이트에서 직접 비교해 보세요. 레디포트는 보험 수수료를 받지 않아요.",
      "link": {
        "type": "official_info",
        "url": "https://www.e-insmarket.or.kr/",
        "label_ko": "공식 비교 사이트 열기"
      },
      "source": "e_insmarket",
      "last_verified": "2026-09-29"
    },
    {
      "id": "payment",
      "name_ko": "결제 수단 두 가지",
      "condition": "always",
      "reason_ko": "카드가 안 될 때를 대비해 결제 수단을 두 가지 이상 준비하세요. 나라별 결제 방법은 여행지 안내에 있어요."
    },
    {
      "id": "medicine",
      "name_ko": "평소 먹는 약·상비약",
      "condition": "always",
      "reason_ko": "현지에서 같은 약을 찾기 어려울 수 있어요. 평소 먹는 약은 넉넉히 챙기세요."
    }
  ],
  "return_links": [
    {
      "id": "customs",
      "label_ko": "관세청 · 여행자 면세 범위",
      "url": "https://customs.go.kr/kcs/cm/cntnts/cntntsView.do?mi=2837&cntntsId=829"
    },
    {
      "id": "apqa_plant",
      "label_ko": "검역본부 · 과일·식물 반입",
      "url": "https://www.apqa.go.kr/plant/imQua/plant_quar_wong_ex.jsp"
    },
    {
      "id": "apqa_livestock",
      "label_ko": "검역본부 · 고기·축산물 반입",
      "url": "https://www.apqa.go.kr/livestock/qua/livestock_imp_sum2.jsp?type=1"
    }
  ],
  "return_facts": [
    {
      "text_ko": "기본 면세 한도는 미화 800달러(과세가격 합계)예요. 넘으면 자진 신고하세요 — 관세의 30%를 줄여 줘요.",
      "source": "customs_allowance",
      "last_verified": "2026-09-29"
    },
    {
      "text_ko": "별도 면세: 술 2L 이하·미화 400달러 이하, 담배 200개비, 향수 100ml. 만 19세 미만은 술·담배 면세가 없어요.",
      "source": "customs_allowance",
      "last_verified": "2026-09-29"
    },
    {
      "text_ko": "망고·파파야·오렌지·포도 같은 생과일은 대부분 들여올 수 없어요. 모든 식물은 입국 때 검역 신고를 해야 해요.",
      "source": "apqa_plant",
      "last_verified": "2026-09-29"
    },
    {
      "text_ko": "고기·햄·소시지·육포 같은 축산물은 가져오지 마세요. 신고하지 않고 걸리면 최고 1,000만 원 과태료예요.",
      "source": "apqa_livestock",
      "last_verified": "2026-09-29"
    }
  ]
}
